{
    "plan_id":  "PLAN-CONTRACT-FIRST-DISPATCH-BATCH3-4-20260403-114449-PK1P",
    "task_id":  "contract-first-dispatch-batch3-4-20260403-114449-pk1p",
    "version":  3,
    "mode":  "proposal-confirm-then-execute",
    "status":  "draft",
    "plan_owner":  "main_window",
    "source_plan_doc":  "docs/plans/contract-first-dispatch-batch3-4-20260403-114449-pk1p.md",
    "plan_md_is_semantic_source":  true,
    "plan_json_is_structured_projection":  true,
    "goal":  "待主协调器补充",
    "why":  "待主协调器补充",
    "scope_in":  [

                 ],
    "scope_out":  [

                  ],
    "acceptance":  [

                   ],
    "stop_conditions":  [

                        ],
    "risks":  [

              ],
    "phase_overview":  [

                       ]
}
