{
    "plan_id":  "PLAN-CONTRACT-FIRST-DISPATCH-BATCH3-4-20260403-153206-GTM2",
    "task_id":  "contract-first-dispatch-batch3-4-20260403-153206-gtm2",
    "version":  3,
    "mode":  "proposal-confirm-then-execute",
    "status":  "frozen",
    "plan_owner":  "main_window",
    "source_plan_doc":  "docs/plans/contract-first-dispatch.md",
    "plan_md_is_semantic_source":  true,
    "plan_json_is_structured_projection":  true,
    "goal":  "按已冻结方案实施 contract-first-dispatch 的 Batch 3、Batch 3.5 与 Batch 4。",
    "why":  "把已冻结的提示词编译规则、合同下沉规则与最小校验闸门真正落到模板、脚本与测试中，使 Execute Window 能稳定推进后续实施。",
    "scope_in":  [
                     "docs/plans/contract-first-dispatch.md",
                     "skills/global-task-orchestrator/assets/prompts/work-order-generator.md",
                     "skills/global-task-orchestrator/assets/prompts/dispatch-packet-generator.md",
                     "skills/global-task-orchestrator/assets/prompts/return-packet-writer.md",
                     "templates/work_order.example.json",
                     "templates/dispatch_packet.example.json",
                     "templates/return_packet.example.json",
                     "skills/global-task-orchestrator/scripts/orchestrator_ctl.ps1",
                     "与派发/回收/验收直接相关的最小检查脚本与测试"
                 ],
    "scope_out":  [
                      "不再次扩容 schema 的大范围字段设计",
                      "不重新设计双窗口模式",
                      "不把提示词工程扩大为通用 prompt library",
                      "不把托管范围扩大到 .system/*、plugins 或第三方 skill",
                      "不做与本方案无关的 broader doctor 扩展",
                      "不做新的业务能力开发"
                  ],
    "decisions":  [
                      "Plan Window 已冻结 docs/plans/contract-first-dispatch.md，Execute Window 只能按此方案实施，不得改写语义。",
                      "本轮执行目标固定为 Batch 3 -\u003e Batch 3.5 -\u003e Batch 4，未通过当前批次验收前不得进入下一批次。",
                      "所有对子代理生效的关键规则，必须下沉到合同对象、派发提示词或最小校验闸门中，而不是默认假定子代理已阅读全文。",
                      "Batch 3 负责提示词正文承载与 dispatch_message_raw 编译口径；中文优先与 return_packet 正文所有权等规则的合同/校验闸门下沉归 Batch 3.5 完成。"
                  ],
    "acceptance":  [
                       "dispatch_message_raw 不再依赖自由发挥，而由合同对象稳定生成。",
                       "复杂任务的执行型工单无法绕过 dispatch_packet 或等价逐文件施工图。",
                       "return_packet 能表达未改项、偏离项、验证命令与阻塞原因。",
                       "至少有一组 happy path / bad path 测试覆盖双窗口与合同派发核心闸门。"
                   ],
    "stop_conditions":  [
                            "双窗口所有权规则尚未冻结。",
                            "plan 与执行阶段边界仍不清晰。",
                            "schema、模板、skill、规则之间存在明显冲突。",
                            "需要扩大到未冻结范围才能继续。"
                        ],
    "risks":  [
                  "若提示词模板、合同模板与校验脚本三者口径不一致，执行窗口会在 Batch 3.5 或 Batch 4 遇到回归阻塞。",
                  "若继续默认子代理已阅读治理真源，合同下沉目标会落空。"
              ],
    "phase_overview":  [
                           "Batch 3：重写执行型/审查型/回执型提示词模板，固定 dispatch_message_raw 编译口径。",
                           "Batch 3.5：把中文优先、mandatory reads、return_packet 正文所有权等规则下沉到合同对象、模板与验收闸门。",
                           "Batch 4：补最小校验与回归测试，形成 happy path / bad path 闭环。"
                       ]
}
