{
  "plan_id": "PLAN-CONTRACT-FIRST-DISPATCH-BATCH25",
  "task_id": "20260402-batch25-plan-dual-track-upgrade",
  "version": 3,
  "mode": "proposal-confirm-then-execute",
  "status": "frozen",
  "plan_owner": "main_window",
  "source_plan_doc": "docs/CONTRACT_FIRST_DISPATCH_PLAN.md",
  "plan_md_is_semantic_source": true,
  "plan_json_is_structured_projection": true,
  "goal": "Finalize Batch 2.5 plan dual-artifact closure for the ai-harness control plane.",
  "why": "Keep the run self-validatable while preserving plan.md semantics and plan.json as structured projection.",
  "scope_in": [
    "schemas/plan.schema.json",
    "templates/plan.example.json",
    "templates/progress.session.example.md",
    "skills/global-task-orchestrator/scripts/bootstrap-task.ps1",
    "skills/global-task-orchestrator/scripts/orchestrator_ctl.ps1",
    "skills/global-task-orchestrator/scripts/validate-control-plane.ps1",
    "scripts/start_session.ps1"
  ],
  "scope_out": [
    "Do not expand work_order, dispatch_packet, or return_packet contracts again.",
    "Do not rewrite prompts or change review strategy.",
    "Do not perform broad runtime refactors."
  ],
  "decisions": [
    "plan.md remains the semantic source for the phase.",
    "plan.json is the structured projection consumed by validation and downstream automation.",
    "Batch 2.5 stays limited to plan schema, examples, progress template, and minimal bootstrap plus validation script support."
  ],
  "acceptance": [
    "plan.schema.json can represent the structured plan projection.",
    "plan.example.json includes source_plan_doc and dual-artifact fields.",
    "progress.session.example.md reflects plan.md-first usage.",
    "bootstrap and validate support the minimum dual-artifact plan flow."
  ],
  "stop_conditions": [
    "A required plan field conflicts with accepted Batch 2.5 behavior.",
    "Completing validation would require reopening out-of-scope implementation files."
  ],
  "risks": [
    "repo_doctor.ps1 is still absent, so validate remains warning-only for that stricter gate.",
    "A richer Markdown plan template still belongs to a later batch."
  ],
  "phase_overview": [
    "Batch 1 governance freeze",
    "Batch 2 contract schema and template upgrade",
    "Batch 2.5 plan dual-artifact template and script closure"
  ]
}
